{"schema_version":"1.0.0","blind_id":"B99f500e921e9","judge_id":"judge_a","rubric_version":"2.0.0","category_scores":{"fidelity":30,"managerial_framing":22,"scholarly_positioning":20,"evidence_discipline":15,"prose_clarity":7},"hard_failures":[],"rationale":{"fidelity":"Correctly distinguishes a usable feasible incumbent from optimality proof and retains makespan, eligibility, assignment, and nonoverlap structure.","managerial_framing":"States the planner, decision, stakes, and latency-versus-confidence tension, but the trigger, counterfactual, and certificate-changed action remain relatively generic.","scholarly_positioning":"Makes no unsupported scholarly claim and positioning was not requested.","evidence_discipline":"Explicitly refuses deadline-certification promises and identifies the required runtime evidence.","prose_clarity":"Clear in substance but verbose, repetitive, and affected by encoding artifacts.","overall":"Fully faithful and cautious, with moderate deductions for managerial specificity and economy."},"raw_total":94,"capped_total":94,"pass":true}
