{"schema_version":"1.0.0","blind_id":"B0a19bda0d4e9","judge_id":"judge_a","rubric_version":"2.0.0","category_scores":{"fidelity":30,"managerial_framing":20,"scholarly_positioning":12,"evidence_discipline":13,"prose_clarity":9},"hard_failures":[],"rationale":{"fidelity":"Correctly diagnoses unavailable realized demand, restores ex ante nonnegative allocation under fixed stock, preserves no recourse, and retains expected shortage-plus-leftover cost.","managerial_framing":"Makes timing, choice, consequence mechanism, and objective concrete, but does not develop a nontrivial managerial trade-off or explicit counterfactual in depth.","scholarly_positioning":"Makes no novelty claim and provides no literature positioning.","evidence_discipline":"Clearly labels distribution representativeness as an assumption and rejects advance-demand and rebalancing claims, with modest discussion of validation limits.","prose_clarity":"Concise, direct, and easy to follow.","overall":"A strong diagnosis and faithful restoration, with lighter managerial and scholarly development."},"raw_total":84,"capped_total":84,"pass":true}
