{"schema_version":"1.0.0","blind_id":"B3254241291a8","judge_id":"judge_b","rubric_version":"2.0.0","category_scores":{"fidelity":30,"managerial_framing":25,"scholarly_positioning":20,"evidence_discipline":15,"prose_clarity":8},"hard_failures":[],"rationale":{"fidelity":"Correctly diagnoses the infeasible type-contingent proposal and repairs it to one common score threshold with latent type and the stated expected-value objective.","managerial_framing":"Clearly presents the screening actor, trigger, common-threshold alternatives, classification trade-off, and operational limits.","scholarly_positioning":"No scholarly positioning is requested or claimed.","evidence_discipline":"Separates conditional score-distribution assumptions from evidence and explicitly rejects type observability, perfect detection, and guaranteed harm reduction.","prose_clarity":"Clear and systematic, but repetitive and longer than necessary.","overall":"A sound hidden-information diagnosis; the failed gates describe the proposed policy, not a hard failure in the response."},"raw_total":98,"capped_total":98,"pass":true}
