{"schema_version":"1.0.0","blind_id":"B1e3c50174ad0","judge_id":"judge_a","rubric_version":"2.0.0","category_scores":{"fidelity":30,"managerial_framing":22,"scholarly_positioning":14,"evidence_discipline":15,"prose_clarity":8},"hard_failures":[],"rationale":{"fidelity":"Preserves model equivalence, feasible integer plans, the cost objective, and runtime as a computational rather than profit outcome.","managerial_framing":"Identifies plausible managerial pathways and correctly states that none is supplied; consequently the concrete operational stakes remain conditional.","scholarly_positioning":"Frames a plausible bounded computational contribution and names missing novelty evidence, but gives no traceable literature relationship.","evidence_discipline":"Scopes the speed result to supplied benchmarks and rejects the unsupported direct profit claim.","prose_clarity":"Clear and well organized, though somewhat repetitive and affected by encoding artifacts.","overall":"A strong model-equivalence diagnosis that keeps solver performance separate from business value and profit."},"raw_total":89,"capped_total":89,"pass":true}
