{"schema_version":"1.0.0","blind_id":"Bc6f0524eb9a9","judge_id":"judge_a","rubric_version":"2.0.0","category_scores":{"fidelity":30,"managerial_framing":24,"scholarly_positioning":14,"evidence_discipline":15,"prose_clarity":8},"hard_failures":[],"rationale":{"fidelity":"Correctly maps binary assortment membership, category capacity, uncertain Markov paths, final purchase outcomes, and expected revenue without making transitions controllable.","managerial_framing":"Clearly explains scarce category capacity, substitution through unavailable items, the feasible-set decision, and practical counterconditions.","scholarly_positioning":"Properly treats novelty as provisional and bounds the contribution, but supplies no traceable literature.","evidence_discipline":"Labels substitution interpretation as an assumption and disclaims parameter accuracy, prevalence, performance, and realized gains.","prose_clarity":"Technically precise and organized, though somewhat template-heavy and dense.","overall":"An excellent fidelity-preserving explanation of the Markov-chain assortment mechanism."},"raw_total":91,"capped_total":91,"pass":true}
