{"schema_version":"1.0.0","blind_id":"Bf5357934d49f","judge_id":"judge_a","rubric_version":"2.0.0","category_scores":{"fidelity":30,"managerial_framing":25,"scholarly_positioning":20,"evidence_discipline":15,"prose_clarity":9},"hard_failures":[],"rationale":{"fidelity":"Fully preserves the common threshold, latent class, observed noisy score, residual errors, loss weights, and immediate expected-loss objective.","managerial_framing":"Provides a complete decision structure, mechanism, trade-off, counterfactual, and operational boundary.","scholarly_positioning":"No scholarly positioning is requested or claimed.","evidence_discipline":"Explicitly labels assumptions, rejects long-run causal claims, and identifies validation needs and boundaries.","prose_clarity":"Clear and systematic, though longer than necessary and affected by minor encoding artifacts.","overall":"A fully faithful decision narrative that handles classification error and causal boundaries rigorously."},"raw_total":99,"capped_total":99,"pass":true}
