{"schema_version":"1.0.0","blind_id":"B6ef7e145dd66","judge_id":"judge_a","rubric_version":"2.0.0","category_scores":{"fidelity":30,"managerial_framing":21,"scholarly_positioning":12,"evidence_discipline":12,"prose_clarity":9},"hard_failures":[],"rationale":{"fidelity":"Correctly keeps hourly staffing as the control, service rates fixed, and arrivals, queues, and waits as realized states under the stated cost objective.","managerial_framing":"Explains the staffing-versus-delay trade-off and congestion mechanism, but gives a less concrete trigger, counterfactual, and implementation boundary than the fuller responses.","scholarly_positioning":"Makes no novelty claim and provides no literature-based positioning.","evidence_discipline":"Labels waiting-cost weights as an assumption and rejects direct control interpretations, but offers limited validation and access boundaries.","prose_clarity":"Concise, coherent, and accessible.","overall":"A compact and fully faithful explanation with lighter managerial and evidence development."},"raw_total":84,"capped_total":84,"pass":true}
