{"schema_version":"1.0.0","blind_id":"B2253b0a153f2","judge_id":"judge_b","rubric_version":"2.0.0","category_scores":{"fidelity":30,"managerial_framing":23,"scholarly_positioning":20,"evidence_discipline":15,"prose_clarity":10},"hard_failures":[],"rationale":{"fidelity":"Correctly rejects future-label routing, retains one ex ante threshold, overlapping distributions, residual errors, and the expected weighted-error objective.","managerial_framing":"Clearly identifies the platform choice, available historical inputs, classification mechanism, and error trade-off; the operational trigger and counterfactual are mostly implicit.","scholarly_positioning":"No scholarly positioning is requested or claimed, so this conditional category is not substantively implicated.","evidence_discipline":"Explicitly labels harm elimination as unsupported and does not invent empirical or causal results.","prose_clarity":"Concise, direct, and precise without unnecessary scaffolding.","overall":"A faithful and economical repair of the clairvoyant narrative with correct information timing and residual-error boundaries."},"raw_total":98,"capped_total":98,"pass":true}
