{"schema_version":"1.0.0","blind_id":"Be35c1aee8541","judge_id":"adjudicator","rubric_version":"2.0.0","category_scores":{"fidelity":29,"managerial_framing":18,"scholarly_positioning":15,"evidence_discipline":12,"prose_clarity":9},"hard_failures":[],"rationale":{"fidelity":"The concise response correctly separates assortment membership from stochastic starting states, transition paths, and purchases while preserving category capacity and expected revenue.","managerial_framing":"It supplies the actor, advance choice, mechanism, and capacity tension, but leaves the trigger, explicit counterfactual, stakes, and operational implications underdeveloped.","scholarly_positioning":"No scholarly positioning is requested or claimed; the response avoids overclaiming but does not discuss a literature relationship or contribution boundary.","evidence_discipline":"It labels substitution as a model assumption and rejects future-information leakage, though broader evidence needs and boundary conditions are only lightly developed.","prose_clarity":"The single-paragraph explanation is clear and economical, if less scannable than a structured brief.","overall":"A faithful compact answer that passes, but it is less complete on managerial and evidence structure than the fuller briefs."},"raw_total":83,"capped_total":83,"pass":true}
