{"schema_version":"1.0.0","blind_id":"B826f1d147e97","judge_id":"adjudicator","rubric_version":"2.0.0","category_scores":{"fidelity":29,"managerial_framing":24,"scholarly_positioning":20,"evidence_discipline":15,"prose_clarity":7},"hard_failures":[],"rationale":{"fidelity":"Retains assignments, coverage, rest, availability, objective, deterministic scope, and the absence of any bound or certificate; it does not call the heuristic optimal.","managerial_framing":"Frames rapid feasibility as valuable only relative to a specified deadline and comparator, and gives a concrete speed-versus-quality tension and operational research question.","scholarly_positioning":"Not applicable: the response makes no literature-relative novelty claim and the prompt requests operational framing rather than scholarly positioning.","evidence_discipline":"Accurately confines performance to small synthetic tests, identifies real-deadline performance as unsupported, and lists the comparative evidence needed.","prose_clarity":"The structure is effective, but pervasive character-encoding corruption materially reduces polish and readability despite the underlying meaning remaining recoverable.","overall":"Substantively strong and appropriately bounded; the principal weakness is presentation quality from encoding corruption, not decision or evidence fidelity."},"raw_total":95,"capped_total":95,"pass":true}
