{"schema_version":"1.0.0","blind_id":"Bee2878f2ce38","judge_id":"adjudicator","rubric_version":"2.0.0","category_scores":{"fidelity":30,"managerial_framing":21,"scholarly_positioning":17,"evidence_discipline":15,"prose_clarity":8},"hard_failures":[],"rationale":{"fidelity":"The response preserves the common feasible integer set, objective, openings and flows, and correctly locates formulation strength in the relaxation and search process rather than in a better-than-optimal plan.","managerial_framing":"It supplies a credible conditional pathway from solve performance to scale or deadlines, but no concrete deadline, action threshold, or operational counterfactual is available.","scholarly_positioning":"It identifies a bounded methodological or computational contribution while withholding novelty absent prior-formulation comparisons.","evidence_discipline":"Faster solution is correctly treated as an inference requiring controlled tests, and universal speed or firm-performance claims are excluded.","prose_clarity":"The organization is strong, though mojibake in several phrases degrades readability.","overall":"A faithful computational-value framing that carefully avoids translating formulation strength directly into operational profit or a superior optimum."},"raw_total":91,"capped_total":91,"pass":true}
